{
 "clip": "grip_hold",
 "duration": 0.2,
 "fps": 30,
 "frames": [
  {
   "bones": {
    "chest": {
     "p": [
      0,
      1.35,
      0.0
     ],
     "q": [
      0.0,
      0.0,
      0.0,
      1.0
     ]
    },
    "hand.R": {
     "p": [
      0.35,
      1.1,
      0.3
     ],
     "q": [
      0.0,
      0.0,
      0.0,
      1.0
     ]
    },
    "hips": {
     "p": [
      0,
      1.0,
      0.0
     ],
     "q": [
      0.0,
      0.0,
      0.0,
      1.0
     ]
    },
    "root": {
     "p": [
      0,
      0,
      0.0
     ],
     "q": [
      0.0,
      0.0,
      0.0,
      1.0
     ]
    },
    "shoulder.R": {
     "p": [
      0.2,
      1.45,
      0.0
     ],
     "q": [
      0.0,
      0.0,
      0.0,
      1.0
     ]
    }
   },
   "landmarks": {
    "grip.guard": [
     0.3,
     1.2,
     0.3
    ],
    "grip.pommel": [
     0.3,
     0.95,
     0.3
    ],
    "hand.center.R": [
     0.35,
     1.1,
     0.3
    ],
    "index.base.R": [
     0.35,
     1.065,
     0.26
    ],
    "index.mid.R": [
     0.325,
     1.13,
     0.28
    ],
    "middle.base.R": [
     0.35,
     1.088,
     0.255
    ],
    "middle.mid.R": [
     0.325,
     1.11,
     0.28
    ],
    "palm.R": [
     0.33,
     1.1,
     0.3
    ],
    "pinky.base.R": [
     0.35,
     1.135,
     0.26
    ],
    "pinky.mid.R": [
     0.325,
     1.07,
     0.28
    ],
    "ring.mid.R": [
     0.325,
     1.09,
     0.28
    ],
    "wrist.R": [
     0.36,
     1.1,
     0.35
    ]
   },
   "props": {
    "blade": {
     "p": [
      0.3,
      1.1,
      0.3
     ],
     "q": [
      0.0,
      0.0,
      0.0,
      1.0
     ]
    }
   },
   "t": 0.0
  },
  {
   "bones": {
    "chest": {
     "p": [
      0,
      1.35,
      0.0
     ],
     "q": [
      0.0,
      0.0,
      0.0,
      1.0
     ]
    },
    "hand.R": {
     "p": [
      0.35,
      1.1,
      0.3
     ],
     "q": [
      0.0,
      0.0,
      0.0,
      1.0
     ]
    },
    "hips": {
     "p": [
      0,
      1.0,
      0.0
     ],
     "q": [
      0.0,
      0.0,
      0.0,
      1.0
     ]
    },
    "root": {
     "p": [
      0,
      0,
      0.0
     ],
     "q": [
      0.0,
      0.0,
      0.0,
      1.0
     ]
    },
    "shoulder.R": {
     "p": [
      0.2,
      1.45,
      0.0
     ],
     "q": [
      0.0,
      0.0,
      0.0,
      1.0
     ]
    }
   },
   "landmarks": {
    "grip.guard": [
     0.3,
     1.2,
     0.3
    ],
    "grip.pommel": [
     0.3,
     0.95,
     0.3
    ],
    "hand.center.R": [
     0.35,
     1.1,
     0.3
    ],
    "index.base.R": [
     0.35,
     1.065,
     0.26
    ],
    "index.mid.R": [
     0.325,
     1.13,
     0.28
    ],
    "middle.base.R": [
     0.35,
     1.088,
     0.255
    ],
    "middle.mid.R": [
     0.325,
     1.11,
     0.28
    ],
    "palm.R": [
     0.33,
     1.1,
     0.3
    ],
    "pinky.base.R": [
     0.35,
     1.135,
     0.26
    ],
    "pinky.mid.R": [
     0.325,
     1.07,
     0.28
    ],
    "ring.mid.R": [
     0.325,
     1.09,
     0.28
    ],
    "wrist.R": [
     0.36,
     1.1,
     0.35
    ]
   },
   "props": {
    "blade": {
     "p": [
      0.3,
      1.1,
      0.3
     ],
     "q": [
      0.0,
      0.0,
      0.0,
      1.0
     ]
    }
   },
   "t": 0.033333
  },
  {
   "bones": {
    "chest": {
     "p": [
      0,
      1.35,
      0.0
     ],
     "q": [
      0.0,
      0.0,
      0.0,
      1.0
     ]
    },
    "hand.R": {
     "p": [
      0.35,
      1.1,
      0.3
     ],
     "q": [
      0.0,
      0.0,
      0.0,
      1.0
     ]
    },
    "hips": {
     "p": [
      0,
      1.0,
      0.0
     ],
     "q": [
      0.0,
      0.0,
      0.0,
      1.0
     ]
    },
    "root": {
     "p": [
      0,
      0,
      0.0
     ],
     "q": [
      0.0,
      0.0,
      0.0,
      1.0
     ]
    },
    "shoulder.R": {
     "p": [
      0.2,
      1.45,
      0.0
     ],
     "q": [
      0.0,
      0.0,
      0.0,
      1.0
     ]
    }
   },
   "landmarks": {
    "grip.guard": [
     0.3,
     1.2,
     0.3
    ],
    "grip.pommel": [
     0.3,
     0.95,
     0.3
    ],
    "hand.center.R": [
     0.35,
     1.1,
     0.3
    ],
    "index.base.R": [
     0.35,
     1.065,
     0.26
    ],
    "index.mid.R": [
     0.325,
     1.13,
     0.28
    ],
    "middle.base.R": [
     0.35,
     1.088,
     0.255
    ],
    "middle.mid.R": [
     0.325,
     1.11,
     0.28
    ],
    "palm.R": [
     0.33,
     1.1,
     0.3
    ],
    "pinky.base.R": [
     0.35,
     1.135,
     0.26
    ],
    "pinky.mid.R": [
     0.325,
     1.07,
     0.28
    ],
    "ring.mid.R": [
     0.325,
     1.09,
     0.28
    ],
    "wrist.R": [
     0.36,
     1.1,
     0.35
    ]
   },
   "props": {
    "blade": {
     "p": [
      0.3,
      1.1,
      0.3
     ],
     "q": [
      0.0,
      0.0,
      0.0,
      1.0
     ]
    }
   },
   "t": 0.066667
  },
  {
   "bones": {
    "chest": {
     "p": [
      0,
      1.35,
      0.0
     ],
     "q": [
      0.0,
      0.0,
      0.0,
      1.0
     ]
    },
    "hand.R": {
     "p": [
      0.35,
      1.1,
      0.3
     ],
     "q": [
      0.0,
      0.0,
      0.0,
      1.0
     ]
    },
    "hips": {
     "p": [
      0,
      1.0,
      0.0
     ],
     "q": [
      0.0,
      0.0,
      0.0,
      1.0
     ]
    },
    "root": {
     "p": [
      0,
      0,
      0.0
     ],
     "q": [
      0.0,
      0.0,
      0.0,
      1.0
     ]
    },
    "shoulder.R": {
     "p": [
      0.2,
      1.45,
      0.0
     ],
     "q": [
      0.0,
      0.0,
      0.0,
      1.0
     ]
    }
   },
   "landmarks": {
    "grip.guard": [
     0.3,
     1.2,
     0.3
    ],
    "grip.pommel": [
     0.3,
     0.95,
     0.3
    ],
    "hand.center.R": [
     0.35,
     1.1,
     0.3
    ],
    "index.base.R": [
     0.35,
     1.065,
     0.26
    ],
    "index.mid.R": [
     0.325,
     1.13,
     0.28
    ],
    "middle.base.R": [
     0.35,
     1.088,
     0.255
    ],
    "middle.mid.R": [
     0.325,
     1.11,
     0.28
    ],
    "palm.R": [
     0.33,
     1.1,
     0.3
    ],
    "pinky.base.R": [
     0.35,
     1.135,
     0.26
    ],
    "pinky.mid.R": [
     0.325,
     1.07,
     0.28
    ],
    "ring.mid.R": [
     0.325,
     1.09,
     0.28
    ],
    "wrist.R": [
     0.36,
     1.1,
     0.35
    ]
   },
   "props": {
    "blade": {
     "p": [
      0.3,
      1.1,
      0.3
     ],
     "q": [
      0.0,
      0.0,
      0.0,
      1.0
     ]
    }
   },
   "t": 0.1
  },
  {
   "bones": {
    "chest": {
     "p": [
      0,
      1.35,
      0.0
     ],
     "q": [
      0.0,
      0.0,
      0.0,
      1.0
     ]
    },
    "hand.R": {
     "p": [
      0.35,
      1.1,
      0.3
     ],
     "q": [
      0.0,
      0.0,
      0.0,
      1.0
     ]
    },
    "hips": {
     "p": [
      0,
      1.0,
      0.0
     ],
     "q": [
      0.0,
      0.0,
      0.0,
      1.0
     ]
    },
    "root": {
     "p": [
      0,
      0,
      0.0
     ],
     "q": [
      0.0,
      0.0,
      0.0,
      1.0
     ]
    },
    "shoulder.R": {
     "p": [
      0.2,
      1.45,
      0.0
     ],
     "q": [
      0.0,
      0.0,
      0.0,
      1.0
     ]
    }
   },
   "landmarks": {
    "grip.guard": [
     0.3,
     1.2,
     0.3
    ],
    "grip.pommel": [
     0.3,
     0.95,
     0.3
    ],
    "hand.center.R": [
     0.35,
     1.1,
     0.3
    ],
    "index.base.R": [
     0.35,
     1.065,
     0.26
    ],
    "index.mid.R": [
     0.325,
     1.13,
     0.28
    ],
    "middle.base.R": [
     0.35,
     1.088,
     0.255
    ],
    "middle.mid.R": [
     0.325,
     1.11,
     0.28
    ],
    "palm.R": [
     0.33,
     1.1,
     0.3
    ],
    "pinky.base.R": [
     0.35,
     1.135,
     0.26
    ],
    "pinky.mid.R": [
     0.325,
     1.07,
     0.28
    ],
    "ring.mid.R": [
     0.325,
     1.09,
     0.28
    ],
    "wrist.R": [
     0.36,
     1.1,
     0.35
    ]
   },
   "props": {
    "blade": {
     "p": [
      0.3,
      1.1,
      0.3
     ],
     "q": [
      0.0,
      0.0,
      0.0,
      1.0
     ]
    }
   },
   "t": 0.133333
  },
  {
   "bones": {
    "chest": {
     "p": [
      0,
      1.35,
      0.0
     ],
     "q": [
      0.0,
      0.0,
      0.0,
      1.0
     ]
    },
    "hand.R": {
     "p": [
      0.35,
      1.1,
      0.3
     ],
     "q": [
      0.0,
      0.0,
      0.0,
      1.0
     ]
    },
    "hips": {
     "p": [
      0,
      1.0,
      0.0
     ],
     "q": [
      0.0,
      0.0,
      0.0,
      1.0
     ]
    },
    "root": {
     "p": [
      0,
      0,
      0.0
     ],
     "q": [
      0.0,
      0.0,
      0.0,
      1.0
     ]
    },
    "shoulder.R": {
     "p": [
      0.2,
      1.45,
      0.0
     ],
     "q": [
      0.0,
      0.0,
      0.0,
      1.0
     ]
    }
   },
   "landmarks": {
    "grip.guard": [
     0.3,
     1.2,
     0.3
    ],
    "grip.pommel": [
     0.3,
     0.95,
     0.3
    ],
    "hand.center.R": [
     0.35,
     1.1,
     0.3
    ],
    "index.base.R": [
     0.35,
     1.065,
     0.26
    ],
    "index.mid.R": [
     0.325,
     1.13,
     0.28
    ],
    "middle.base.R": [
     0.35,
     1.088,
     0.255
    ],
    "middle.mid.R": [
     0.325,
     1.11,
     0.28
    ],
    "palm.R": [
     0.33,
     1.1,
     0.3
    ],
    "pinky.base.R": [
     0.35,
     1.135,
     0.26
    ],
    "pinky.mid.R": [
     0.325,
     1.07,
     0.28
    ],
    "ring.mid.R": [
     0.325,
     1.09,
     0.28
    ],
    "wrist.R": [
     0.36,
     1.1,
     0.35
    ]
   },
   "props": {
    "blade": {
     "p": [
      0.3,
      1.1,
      0.3
     ],
     "q": [
      0.0,
      0.0,
      0.0,
      1.0
     ]
    }
   },
   "t": 0.166667
  },
  {
   "bones": {
    "chest": {
     "p": [
      0,
      1.35,
      0.0
     ],
     "q": [
      0.0,
      0.0,
      0.0,
      1.0
     ]
    },
    "hand.R": {
     "p": [
      0.35,
      1.1,
      0.3
     ],
     "q": [
      0.0,